{
  "capability": "oas.aweb",
  "command": "aweb",
  "version": "1.5.1",
  "compatibility": {
    "oas": ">=0.19.0"
  },
  "layer": "messaging",
  "description": "Messaging layer via aweb: per-instance team identities + native aw mail/chat skills + cross-machine team roster.",
  "requires": [
    {
      "command": "aw",
      "why": "identity minting at spawn, self-delete at retire, and all agent messaging",
      "install": "https://aweb.ai/docs (aw CLI)"
    }
  ],
  "skills": [
    "skills/aweb-messaging",
    "skills/aweb-team-membership",
    "skills/aweb-identity"
  ],
  "inject": "injects/aweb.md",
  "commands": {
    "roster": "bin/oas-aweb.mjs roster",
    "setup": "bin/oas-aweb.mjs setup"
  },
  "hooks": {
    "spawn": "bin/oas-aweb.mjs spawn",
    "retire": "bin/oas-aweb.mjs retire"
  }
}
