{
  "capability": "oas.review",
  "version": "1.2.0",
  "compatibility": { "oas": ">=0.16.0" },
  "description": "Post-commit review discipline: a fresh reviewer agent (defined by this capability) reviews each new commit's diff, reports its verdict to its spawner over the deployment's messaging layer (or in its transcript when there is none), and retires — plus the shared developer delivery discipline.",
  "requires": [],
  "agents": ["agents/reviewer"],
  "skills": ["skills/code-review", "skills/security-review"],
  "inject": "injects/review.md"
}
