{
  "capability": "oas.linear",
  "command": "linear",
  "version": "1.0.0",
  "compatibility": { "oas": ">=0.6.2" },
  "layer": "tasks",
  "description": "Tasks layer via Linear: JSON-first GraphQL commands, project/issue/sub-issue workflow, label-based agent identity.",
  "requires": [],
  "skills": [
    "skills"
  ],
  "commands": {
    "auth": "bin/oas-linear.mjs auth",
    "teams": "bin/oas-linear.mjs teams",
    "states": "bin/oas-linear.mjs states",
    "projects": "bin/oas-linear.mjs projects",
    "labels": "bin/oas-linear.mjs labels",
    "issue": "bin/oas-linear.mjs issue"
  },
  "inject": "injects/linear.md",
  "hooks": {
    "spawn": "bin/oas-linear-hook.mjs spawn"
  }
}
