{
  "capability": "oas.review",
  "version": "1.1.7",
  "compatibility": { "oas": ">=0.19.0" },
  "description": "Post-commit review discipline: a fresh reviewer agent (defined by this capability) reviews each new commit's diff, reports by aweb mail to its spawner, and retires — plus the shared developer delivery discipline.",
  "requires": [],
  "agents": ["agents/reviewer"],
  "skills": ["skills/code-review", "skills/security-review"],
  "inject": "injects/review.md"
}
