{
  "capability": "oas.web",
  "command": "web",
  "version": "0.8.0",
  "compatibility": { "oas": ">=0.14.0" },
  "description": "Local web control panel: live instance roster, terminal-faithful ANSI session mirror (hand-rolled renderer, no deps), and direct keyboard passthrough (single terminal input path) for pi and claude sessions; agent roster with spawn-from-browser (default: no task, awaiting instructions); Jira epic/roster panel when oas.jira is active.",
  "requires": [
    {
      "command": "tmux",
      "why": "session capture and keystroke injection for the live panel",
      "install": "brew install tmux"
    }
  ],
  "commands": {
    "start": "bin/oas-web.mjs start"
  }
}
