{
  "capability": "oas.authoring",
  "version": "1.0.0",
  "compatibility": { "oas": ">=0.6.2" },
  "description": "Additive framework-authoring guidance for capability packages, agent skills, and souls.",
  "requires": [],
  "skills": [
    "../../skills/integration-authoring",
    "../../skills/skill-craft",
    "../../skills/soul-craft"
  ]
}
