{
  "capability": "oas.jira",
  "command": "jira",
  "version": "1.0.0",
  "compatibility": { "oas": ">=0.6.2" },
  "layer": "tasks",
  "description": "Tasks layer via Jira: acli-based epic/story/task protocol, agent roster in epic descriptions, label-based agent identity.",
  "requires": [
    {
      "command": "acli",
      "why": "all Jira operations (search, view, create, transition, comment)",
      "install": "https://developer.atlassian.com/cloud/acli/guides/install-acli/"
    }
  ],
  "skills": [
    "skills"
  ],
  "inject": "injects/jira.md",
  "hooks": {
    "spawn": "bin/oas-jira.mjs spawn"
  }
}
