{
  "capability": "oas.aweb",
  "command": "aweb",
  "version": "1.7.2",
  "compatibility": {
    "oas": ">=0.6.2"
  },
  "layer": "messaging",
  "description": "Messaging layer via aweb: per-instance team identities + native aw mail/chat skills + cross-machine team roster.",
  "requires": [
    {
      "command": "aw",
      "why": "identity minting at spawn, self-delete at retire, and all agent messaging",
      "install": "https://aweb.ai/docs (aw CLI)"
    },
    {
      "runtime": "pi",
      "package": "npm:@awebai/pi",
      "why": "the aweb channel extension for pi sessions \u2014 real-time mail/chat awakenings; without it a pi instance can send with `aw` but is never woken by incoming messages",
      "install": "https://aweb.ai/docs (installed into pi with `pi install npm:@awebai/pi`)"
    }
  ],
  "skills": [
    "node_modules/@awebai/pi/skills/aweb-messaging",
    "node_modules/@awebai/pi/skills/aweb-team-membership",
    "node_modules/@awebai/pi/skills/aweb-identity"
  ],
  "inject": "injects/aweb.md",
  "commands": {
    "roster": "bin/oas-aweb.mjs roster",
    "setup": "bin/oas-aweb.mjs setup"
  },
  "hooks": {
    "spawn": {
      "command": "bin/oas-aweb.mjs spawn",
      "required": true
    },
    "retire": "bin/oas-aweb.mjs retire"
  }
}
